{
  "sourceId": "address-item-2",
  "source": "addressItems",
  "providerMode": "OPEN_DATA",
  "demoMode": false,
  "inputAddress": "350 5th Ave, New York, NY 10118",
  "formattedAddress": "350 5TH AVE NEW YORK NY 10118",
  "latitude": 40.747848600317,
  "longitude": -73.985077152891,
  "geocodingPlaceId": "US_CENSUS_TIGER:59653473",
  "geocodingLocationType": "TIGER_ADDRESS_RANGE_INTERPOLATION",
  "geocodingConfidenceLevel": "medium",
  "regionCode": "US",
  "administrativeAreaCode": "NY",
  "postalCode": "10118",
  "status": "qualified",
  "leadScore": 91,
  "qualified": true,
  "scenarioPanels": 57,
  "scenarioSystemCapacityKw": 25,
  "specificYieldKwhPerKwp": 1466,
  "annualIrradiationKwhM2": 1794,
  "estimatedAnnualEnergyKwhAc": 36644,
  "estimatedAnnualEnergyKwhAcLow": 29315,
  "estimatedAnnualEnergyKwhAcHigh": 43972,
  "estimatedAnnualSavingsUsd": null,
  "simplePaybackYears": null,
  "grossAnnualEnergyValueUsd": null,
  "grossValueSimplePaybackYears": null,
  "assessmentScope": "user_system_capacity",
  "capacitySource": "item_system_capacity",
  "openDataConfidence": "low",
  "assessmentConfidenceScore": null,
  "evidenceCompletenessScore": 50,
  "requiresSiteSurvey": true,
  "pvgisPanelTiltDegrees": 38,
  "pvgisPanelAzimuthDegrees": -5,
  "pvgisAnnualVariabilityKwhPerKwp": 38.6,
  "pvgisTotalLossPercent": 18.3,
  "pvgisMountingType": "free-standing",
  "pvgisMountingPlace": "free",
  "pvgisPvTechnology": "crystSi2025",
  "radiationDatabase": "PVGIS-ERA5",
  "meteorologicalDatabase": "ERA5",
  "dataYearStart": 2005,
  "dataYearEnd": 2023,
  "horizonSource": "DEM-calculated",
  "limitations": [
    "No roof-plane geometry, obstructions, nearby tree/building shade, structural condition, or panel layout was measured.",
    "PVGIS models regional solar resource and terrain horizon; it does not model parcel-level rooftop shading.",
    "Verify the address match, roof dimensions, orientation, electrical connection, permits, tariff, and economics before a quote."
  ],
  "reasonCodes": [
    "STRONG_OPEN_SOLAR_RESOURCE",
    "USER_SUPPLIED_SYSTEM_CAPACITY",
    "QUALIFIED_PRE_SCREEN"
  ],
  "explanation": [
    "1466 kWh/kWp annual PVGIS yield supports strong production.",
    "Open-data pre-screen score 91 meets the 65 threshold."
  ],
  "googleMapsAttribution": null,
  "solarDataAttribution": "European Commission Joint Research Centre - PVGIS 5.3",
  "derivedContentAttribution": "Derived by Solar Rooftop Lead Scorer from PVGIS and user assumptions.",
  "googleContentExpiresAt": null,
  "dataSource": {
    "geocoding": "U.S. Census Geocoder Public_AR_Current",
    "solarResource": "European Commission JRC PVGIS 5.3",
    "rooftopGeometry": "Not measured"
  },
  "dataSourceUrls": {
    "geocoding": "https://geocoding.geo.census.gov/geocoder/",
    "solarResource": "https://re.jrc.ec.europa.eu/pvg_tools/en/"
  },
  "processedAt": "2026-07-28T14:52:39.915Z"
}
